{
  "id": "",
  "name": "",
  "aliases": [],
  "appearance": {},
  "voice": {},
  "personality": {},
  "values": [],
  "flaws": [],
  "goals": {},
  "fears": [],
  "boundaries": [],
  "skills": [],
  "work": {},
  "past": [],
  "connections": [],
  "schedule": {},
  "tags": [],
  "starting_knowledge": [],
  "initial_relationships": []
}
